{"schema":"agent-package.v1","id":"example.test/helper","name":"helper","displayName":"Helper","version":"1.2.0","publisher":{"domain":"example.test"},"licence":{"spdx":"Apache-2.0"},"identity":{"role":"a helper"},"prompts":["prompts/identity.md"],"capabilities":{"required":["repo.read"],"optional":["repo.write"],"denied":["net.fetch"]},"harness":{"requires":["structured_output"]},"placement":{"allowed":["client"]},"outputSchemas":{"default":"schemas/outcome.json"}}
